sentence1,sentence2,label
"Создавать простые диаграммы","Построение базовых BPMN-диаграмм или блок-схем",0.5
"Определять задачи в рамках цели","Создание планов выполнения задач с указанием сроков и ответственных лиц",0.6
"Взаимодействовать с заказчиками проектов","Эффективное управление коммуникацией с заказчиками на всех этапах проекта",1.0
"Обеспечивать доступность","Создание интерфейсов, доступных для людей с ограниченными возможностями (WCAG)",0.5
"Принимать решения в нестандартных ситуациях","Использование инструментов управления проектами для принятия решений",0.4
"Разработчик мобильных приложений","Знакомство с основами мобильной разработки и инструментами программирования",0.1
"Разработчик мобильных приложений","Базовое понимание принципов разработки мобильных приложений",0.2
"Проводить ручное тестирование","Базовое понимание принципов ручного тестирования и его этапов",0.2
"Собирать обратную связь","Проведение опросов и интервью для анализа удовлетворенности пользователей",0.3
"Использовать библиотеки компьютерного зрения","Работа с OpenCV, TensorFlow, PyTorch или Detectron2",0.7
"Теория автоматического управления","Базовое понимание принципов теории автоматического управления",0.2
"Проектировать хранилища данных (Data Warehouse)","Создание систем для аналитики больших объемов данных",0.5
"Автоматизировать процессы разработки","Настройка CI/CD-пайплайнов с использованием Jenkins, GitLab CI или GitHub Actions",0.9
"Математическое моделирование процессов","Проведение экспериментов и тестирование математических моделей",0.3
"Тестировать API","Автоматизация проверки запросов и ответов через Postman, RestAssured или аналоги",0.7
"Автоматизировать тест-кейсы","Перевод ручных тестов в автоматизированные сценарии с использованием Selenium, JUnit и др.",0.5
"Адаптировать типовые решения","Доработка стандартных конфигураций под специфику бизнеса",0.4
"Писать спецификации для API","Описание эндпоинтов, методов, параметров запросов и форматов ответов для разработчиков",0.9
"Взаимодействовать с заказчиками проектов","Координация работы команды разработки с учетом обратной связи заказчика",0.5
"Тестировать масштабируемость","Проверка способности системы работать при увеличении числа пользователей",0.5
"Обязательно знание SQL","Использование инструментов администрирования баз данных (phpMyAdmin, pgAdmin)",0.4
"Определять выбор технических средств для макета","Использование современных инструментов прототипирования для проверки жизнеспособности макета",0.7
"Администратор баз данных","Оптимизация запросов и индексов для повышения производительности баз данных",0.8
"Проводить тестирование интерфейсов","Разработка чек-листов и тест-кейсов для проверки работоспособности интерфейсов",0.9
"Проводить аудит безопасности","Анализ системы на наличие уязвимостей и их устранение",1.0
"Применение JavaScript","Использование библиотек и инструментов (Lodash, Axios, D3.js) для улучшения функциональности приложений",0.6
"Собирать требования заказчика","Проведение интервью и анкетирования для формализации потребностей клиентов",0.5
"Планировать выполнение работ по макету","Отсутствие опыта или знаний в области планирования работ по макету",0.0
"Настраивать CI/CD-пайплайны","Интеграция автотестов в процессы непрерывной интеграции и доставки",0.9
"Математический анализ","Знакомство с основами дифференциального и интегрального исчисления",0.1
"Термодинамика","Знание основ бухгалтерского учета",0.1
"Осуществлять автоматическое тестирование","Использование фреймворков (Selenium, Cypress, TestNG) для создания автотестов",0.9
"Создавать схемы архитектуры","Знакомство с инструментами и методами визуализации архитектуры",0.1
"Оценивать соответствие требованиям качества","Подготовка отчетов о соответствии продукта требованиям качества и предложения по улучшению",0.6
"Тестировать backend-код","Написание простых unit-тестов для проверки функционала",1.0
"Определять первичные и внешние ключи","Настройка уникальных идентификаторов и связей между таблицами",0.7
"Анализировать требования к ПО","Формализация и управление требованиями заказчика",0.2
"Использовать базовые конструкции языка","Применение переменных, циклов, условий и функций в решении задач",0.7
"Охватывать все требования","Убедиться, что тест-кейсы покрывают все функциональные и нефункциональные требования",0.7
"Оптимизировать производительность","Устранение узких мест в монолитной архитектуре",0.7
"Определять потребности в оборудовании","Подбирать технику для печати",0.8
"Документировать разработку","Создание технической документации для разработчиков и пользователей",0.4
"Основы программирования на C++","Отсутствие опыта программирования на C++",0.0
"Работать с многопоточностью","Создание многопоточных приложений с использованием POSIX Threads",0.4
"Работать с контейнерами","Использование Docker и Kubernetes для управления контейнеризированными приложениями",0.4
"Визуализировать результаты классификации","Построение confusion matrix, ROC-кривых или границ решений",0.5
"Понимать устную речь","Восприятие информации из подкастов, видео или живой речи",1.0
"Документировать облачные архитектуры","Создание схем и описаний облачных решений для команды",0.1
"Специалист по машинному обучению","Оптимизация моделей машинного обучения для повышения точности и производительности",0.7
"Математическое моделирование","Знакомство с основами математического моделирования и его инструментами",0.1
"Проводить ретроспективы","Анализ завершенных спринтов для выявления улучшений",0.2
"Анализировать требования","Оценка полноты, согласованности и реализуемости требований",0.7
"Использовать современные фреймворки","Работа с Hibernate, Apache Kafka, Maven/Gradle для сборки проектов",0.1
"Учитывать граничные условия","Тестирование работы системы на предельных значениях входных данных",1.0
"Собирать обратную связь","Проведение опросов и интервью для анализа удовлетворенности пользователей",0.2
"Управлять командой","Распределение ролей и мотивация участников для достижения целей",0.7
"Вакансия: преподаватель информатики.","Ищем учителя программирования для школы.",0.8
"Обязательно знание SQL","Создание и поддержка триггеров, хранимых процедур и функций в SQL",0.8
"Описывать функции и модули","Четкое указание входных данных, выходных данных и целей функций",1.0
"Оптимизировать рабочие процессы","Переход от ручного выполнения задач к автоматизированным решениям",0.3
"Разрабатывать пользовательские интерфейсы","Создание дружественных интерфейсов для информационных систем",0.6
"Оптимизировать базы данных","Написание эффективных SQL-запросов и индексация таблиц для повышения производительности",0.9
"Умение работать с таблицами Excel","Создание шаблонов и стандартных форм для регулярной работы с данными",0.3
"Обеспечивать защиту данных","Реализация мер для предотвращения утечек и несанкционированного доступа",0.8
"Распределять задачи внутри команды","Определение ролей и обязанностей для каждого участника",0.6
"Использовать шаблоны документации","Применение стандартов, таких как IEEE 830 или Volere для SRS",0.5
"Обсуждать задачи с аналитиками","Обсуждение приоритетов и сроков выполнения задач с учетом аналитических выводов",0.7
"Поддерживает физическую подготовленность","Оптимизировать рабочий график",0.1
"Тестировать свой код","Проверка работы программы на различных входных данных",0.9
"Устанавливать серверное ПО","Базовое понимание процесса установки и настройки серверного ПО",0.2
"Применение численных методов","Выполнение простых численных расчетов для учебных или прикладных задач",0.3
"Использовать численные методы","Приближенное решение уравнений и задач оптимизации",0.5
"Тестировать после завершения разработки","Проведение тестирования только после завершения кодирования",0.6
"Обеспечивать информационную безопасность АСУ","Внедрение мер защиты данных и предотвращение несанкционированного доступа",0.6
"Обязательно знание SQL","Отсутствие опыта или знаний в области SQL",0.0
"Формулировать пред- и постусловия","Описание состояния системы до и после выполнения сценария",0.5
"Определять масштабируемость","Указание способности системы работать при увеличении нагрузки",0.8
"Планировать предпринимательскую деятельность","Разрабатывать бизнес-план стартапа",0.9
"Использовать информационные технологии","Отсутствие опыта или знаний в области использования информационных технологий",0.0
"Документировать API","Создание документации с помощью Swagger/OpenAPI или Postman",1.0
"Разработка и проектирование программных систем","Оптимизация производительности и отказоустойчивости программных решений",0.6
"Работать с рядами","Исследование сходимости числовых и функциональных рядов",0.4
"Создавать API","Разработка RESTful или GraphQL API для взаимодействия с клиентской частью",1.0
"Анализировать результаты тестирования","Использование Allure, ReportPortal или других инструментов для отчетов",0.1
"Использовать компиляторы и сборщики","Настройка GCC, Clang и Makefile для сборки проектов",0.2
"Документировать ошибки и исключения","Описание возможных ошибок и способов их устранения",0.3
"Знание основ маркетинга","Применение методов A/B-тестирования для улучшения маркетинговых решений",0.4
"Применение JavaScript","Написание оптимизированного и масштабируемого кода для клиентской и серверной части (Node.js)",0.9
"Управлять эмоциями","Контроль своих реакций и предотвращение конфликтов в напряженных ситуациях",0.7
"Теплотехника","Проектирование систем кондиционирования",0.6
"Применение JavaScript","Разработка и интеграция RESTful API и WebSocket-соединений для взаимодействия с сервером",0.7
"Использовать современные стандарты C++","Применение возможностей C++17, C++20 или выше",0.3
"Разрабатывать стандарты операционной деятельности","Создание регламентов и инструкций для сотрудников",0.4
"Эксперт в области анализа данных","Подготовка отчетов и дашбордов для визуализации данных (Power BI, Tableau)",0.4
"Настраивать виртуальное окружение","Работа с virtualenv или venv для управления зависимостями",0.5
"Готовиться к переговорам","Сбор информации и определение целей перед встречей",0.9
"Программирование на Python","Разработка сложных приложений, веб-сервисов и автоматизированных систем с использованием Python",1.0
"Грамотная письменная и устная речь","Знакомство с основами грамотной устной и письменной коммуникации",0.1
"Строить диаграммы активностей","Визуализация бизнес-процессов или алгоритмов",0.8
"Использовать JSONB и NoSQL-функции","Хранение и работа с полуструктурированными данными",0.4
"Мониторить IT-инфраструктуру","Использование инструментов (Zabbix, Nagios) для контроля состояния системы",0.8
"Разрабатывать веб-приложения","Оптимизация производительности и масштабируемости веб-приложений",0.6
"Осуществлять сбор и анализ данных для ТЗ","Отсутствие опыта или знаний в области сбора и анализа данных для ТЗ",0.0
"Документировать свои проекты","Описание кода и создание README-файлов для своих работ",0.1
"Решать проблемы творчески","Применение инновационных подходов для преодоления трудностей",0.7
"Документировать код и архитектуру","Создание документации для разработчиков и поддержки",0.3
"Обрабатывать события в реальном времени","Работа с WebSocket или Server-Sent Events для мгновенных обновлений",1.0
"Использовать инструменты для IDEF1X","Работа с ERwin, CA ERwin Data Modeler или другими средствами",0.4
"Анализировать прошлые проекты","Изучение ошибок и успехов для улучшения управления рисками в будущем",0.1
"Активно слушать собеседника","Внимательное восприятие чужой точки зрения без перебоев",0.7
"Внедрять информационные системы","Интеграция ERP, CRM или других систем для управления данными",0.7
"Решать задачи динамического программирования","Разработка алгоритмов с использованием кэширования результатов",1.0
"Управлять изменениями в организации","Снижение сопротивления сотрудников и адаптация к новым процессам",0.3
"Отлаживать код","Использование print() или инструментов отладки для поиска ошибок",0.1
"Учитывает информационную безопасность","Шифровать данные",0.8
"Настраивать шифрование данных","Обеспечение сквозного шифрования данных в базах данных, сетях и облачных хранилищах",0.9
"Реагировать на инциденты","Устранение последствий утечек данных и восстановление системы",0.1
"Проводить ручное тестирование","Создание подробных тест-кейсов и сценариев для проверки работоспособности приложений",0.9
"Оптимизировать CSS-стили","Написание модульных и масштабируемых стилей с использованием SASS или Tailwind CSS",0.3
"Внедрять системы управления процессами","Настройка и использование BPM-систем (например, Camunda, Bizagi)",0.1
"Взаимодействовать с заказчиками проектов","Использование инструментов для управления взаимодействием (CRM-системы, Slack, email)",0.4
"Участвовать в планировании и реализации IT-проектов в составе команды разработчиков","Знакомство с принципами работы в команде разработчиков",0.1
"Организовывать собственную деятельность","Планировать задачи в Jira",0.8
"Разрабатывать дашборды","Создание интерактивных панелей в Tableau, Power BI или Google Data Studio",0.7
"Автоматизировать документооборот","Использование облачных решений для хранения и обработки документов",0.4
"Анализировать потребности бизнеса","Определение целей и задач для внедрения информационной системы",0.9
"Проектирует решение задачи с учетом норм и ресурсов","Оптимизировать код в рамках бюджета",0.6
"Использовать структуры данных","Применение массивов, списков, деревьев, графов и хэш-таблиц",0.8
"Основы программирования на C++","Управление проектами в Jira",0.1
"Анализировать данные","Использование методов анализа для извлечения полезной информации из данных",0.9
"Анализировать бизнес-процессы","Изучение текущих процессов для выявления точек автоматизации",0.6
"Разрабатывать программное обеспечение","Написание кода и создание функционала под требования заказчика",0.7
"Организовывать Scrum-процессы","Проведение планирования, дейли-митингов, ревью и ретроспектив",0.9
"Специалист по машинному обучению","Использование облачных платформ (AWS, Google Cloud, Azure) для развертывания ML-решений",0.5
"Проводить ручное тестирование","Использование инструментов управления дефектами (Jira, TestRail) для отслеживания ошибок",0.5
"Обучаться новым инструментам","Освоение новых программ и технологий для улучшения навыков",0.1
"Анализировать результаты тестов","Интерпретация логов и отчетов для выявления проблем",0.4
"Автоматизировать процессы в облаке","Использование Terraform, Ansible или CloudFormation для автоматизации",0.6
"Базы данных и SQL","Выполнение операций импорта/экспорта данных и резервного копирования",0.3
"Документировать UX-решения","Фиксация выводов и рекомендаций по улучшению пользовательского опыта",0.1
"Тестировать программное обеспечение","Написание unit-тестов, интеграционных тестов и автоматизация проверок",0.8
