sentence1,sentence2,label
"Создавать четкие тест-кейсы","Описание шагов, входных данных и ожидаемых результатов для проверки функциональности",0.9
"Заниматься самообразованием","Знакомство с концепцией самообразования и некоторыми доступными ресурсами",0.1
"Электромагнетизм","Опыт работы с графическими редакторами",0.0
"Применять принципы визуальной иерархии","Организация элементов для акцента на важной информации",0.6
"Анализировать и синтезировать информацию","Исследование и обобщение информации из различных источников для создания комплексных отчетов",0.9
"Эксперт в области анализа данных","Интерпретация результатов анализа данных для принятия бизнес-решений на высшем уровне",0.8
"Настраивать шифрование данных","Участие в базовой настройке шифрования под руководством опытных специалистов",0.4
"Изучать технические требования","Знакомство с процессом изучения и документирования технических требований",0.1
"Разработка и проектирование программных систем","Знакомство с процессами разработки и жизненного цикла программных систем",0.1
"Мониторить системы","Использование инструментов (Prometheus, Grafana, ELK) для отслеживания состояния",0.8
"Применение численных методов","Базовое понимание принципов численных методов и их применения",0.2
"Изучать новые подходы в ИИ","Следить за трендами, такими как GANs, Reinforcement Learning или Transformer",0.1
"Осуществлять сбор и анализ данных для ТЗ","Сбор требований заказчиков и анализ их для создания четких и измеримых ТЗ",0.9
"Необходим специалист по машинному обучению.","Требуется эксперт в области анализа данных.",0.7
"Использовать предобученные модели","Применение Transfer Learning для экономии времени и ресурсов",0.1
"Моделировать процессы","Создание математических и компьютерных моделей для прогнозирования",0.2
"Анализировать данные в CRM","Формирование отчетов по продажам, лидам и клиентской базе",1.0
"Автоматизировать документооборот","Отсутствие опыта или знаний в области автоматизации документооборота",0.0
"Обеспечивать трассируемость требований","Связывание требований с задачами, тестами и результатами",0.5
"Изучать новые фреймворки","Отсутствие опыта или знаний в области изучения новых фреймворков",0.0
"Разрабатывать веб-приложения","Использование инструментов автоматизации сборки и деплоя (Docker, Jenkins)",0.4
"Создание контента для социальных сетей","Разработка стратегии контент-планирования и создание вовлекающего контента для социальных платформ",1.0
"Визуализировать данные","Создание дашбордов и графиков в Tableau, Power BI или Python (Matplotlib, Seaborn)",0.8
"Применять статистические методы","Использование статистики для выявления трендов и аномалий",1.0
"Интерпретировать результаты моделей","Объяснение выводов нейросетей для неспециалистов",0.1
"Умение работать с таблицами Excel","Знакомство с интерфейсом Excel и основными функциями",0.1
"Выявлять потребности клиентов","Анализ запросов и предложение оптимальных решений",0.9
"Разрабатывать веб-приложения","Разработка клиентской и серверной части веб-приложений (Full-stack разработка)",0.9
"Физика полупроводников","Понимание принципов работы транзисторов",0.9
"Взаимодействовать с заинтересованными сторонами","Подтверждение корректности Use Cases с заказчиками и пользователями",0.3
"Устанавливать серверное ПО","Выполнение полной установки и настройки серверного программного обеспечения (ОС, веб-серверы, СУБД)",1.0
"Автоматизировать документооборот","Обеспечение безопасности и контроля доступа к документам в автоматизированной системе",0.6
"Курс предназначен для начинающих программистов.","Программа ориентирована на продвинутых специалистов.",0.1
"Изучать технические требования","Выявление скрытых или неявных требований в технической документации",0.8
"Разработчик мобильных приложений","Реализация пользовательских интерфейсов (UI/UX) для мобильных платформ",0.6
"Обсуждать задачи с аналитиками","Использование результатов анализа данных для оптимизации процессов и решений",0.6
"Обеспечивать безопасность приложений","Защита данных и предотвращение уязвимостей в коде",0.6
"Программирование на Python","Оптимизация кода и работа с базами данных через ORM (SQLAlchemy, Peewee)",0.6
"Оценивать качество моделей","Использование метрик (accuracy, loss, F1-score) для анализа результатов",0.5
"Адаптировать ПО под рынки","Участие в базовой локализации ПО под руководством опытных специалистов",0.3
"Внедрять ERP-системы","Настройка и интеграция системы под бизнес-процессы компании",0.8
"Применение численных методов","Анализ точности и устойчивости численных решений в зависимости от входных данных",0.8
"Писать спецификации для API","Создание детальных и стандартизированных спецификаций для RESTful и GraphQL API с использованием OpenAPI/Swagger",1.0
"Осуществлять коммуникацию на государственном языке","Создание профессиональных текстов (отчеты, документация, статьи) на государственном языке",0.8
"Тестировать ПО","Выполнение функционального и регрессионного тестирования программного обеспечения",1.0
"Контролировать KPI процессов","Мониторинг ключевых показателей для оценки эффективности",1.0
"Токенизировать для машинного обучения","Подготовка данных для моделей, таких как BERT или GPT",0.6
"Обрабатывать данные для обучения","Предобработка изображений, текстов или временных рядов",0.6
"Управлять жизненным циклом ПО","Применение методологий (Waterfall, Agile) для разработки и поддержки ПО",0.7
"Работать со светом и камерой","Настройка освещения и ракурсов для качественных рендеров",0.7
"Убеждать и аргументировать","Использование логики и фактов для поддержки своей позиции",1.0
"Обучать сотрудников кибербезопасности","Проведение тренингов по распознаванию фишинга и других угроз",0.3
"Выполнять этапы последовательно","Строгая последовательность выполнения этапов без возврата к предыдущим",1.0
"Координировать действия с коллегами","Синхронизация усилий для достижения общей цели",0.8
"Программирование на Python","Отладка и тестирование программного кода с использованием инструментов (Pytest, unittest)",0.5
"Настраивать шифрование данных","Тестирование и аудит настроек шифрования для обеспечения соответствия стандартам безопасности",0.6
"Автоматизировать процессы","Написание скриптов для автоматизации сборки, тестирования и деплоя",1.0
"Обучать нейронные сети","Настройка архитектуры и обучение моделей на больших датасетах",1.0
"Выбирает стратегию коммуникации с учетом инклюзии","Тестировать доступность интерфейсов",0.1
"Обеспечивать воспроизводимость тестов","Создание четких инструкций для повторного выполнения тестов",0.4
"Обеспечивать кросс-браузерную совместимость","Тестирование и исправление ошибок отображения в разных браузерах",0.8
"Настраивать облачные сервисы","Участие в настройке облачных сервисов под руководством опытных специалистов",0.3
"Писать чистый и поддерживаемый код","Соблюдение принципов clean code и использование паттернов проектирования",0.8
"Готовить техническую документация","Участие в проверке и верификации технической документации под руководством старших специалистов",0.3
"Писать SQL-запросы","Выполнение операций SELECT, INSERT, UPDATE, DELETE для работы с данными",0.7
"Обращаться за помощью","Использование форумов (Stack Overflow) и общение с коллегами",0.2
"Программирование на Python","Создание алгоритмов машинного обучения и анализа данных с использованием библиотек (NumPy, Pandas, Scikit-learn)",0.9
"Создавать README-файлы","Написание краткого описания проекта, его установки и использования",0.5
"Оказывать экстренную помощь","Проведение реанимационных мероприятий и первой помощи",0.2
"Принимать решения в нестандартных ситуациях","Знакомство с методами анализа и решения проблем",0.1
"Активно слушать собеседника","Внимательное восприятие чужой точки зрения без перебоев",0.7
"Разработка и проектирование программных систем","Участие в согласовании архитектурных решений с заказчиками и разработчиками",0.5
"Разрабатывать веб-приложения","Интеграция баз данных и сторонних сервисов в веб-приложения",0.7
"Изучать новые фреймворки","Базовое понимание процесса изучения и применения новых фреймворков",0.2
"Инженерная графика","Организация мероприятий",0.0
"Обучать сотрудников использованию новых систем","Проведение тренингов по работе с автоматизированными инструментами",0.2
"Осуществлять сбор и анализ данных для ТЗ","Базовое понимание принципов сбора и анализа данных для ТЗ",0.2
"Модернизировать существующие АСУ","Внедрение новых технологий и обновление устаревших решений",0.1
"Деплоить приложения","Развертывание проектов на серверах (Heroku, AWS, DigitalOcean)",0.3
"Необходим специалист по кибербезопасности.","Требуется администратор баз данных.",0.1
"Участвовать в Agile-процессах","Понимание основ Scrum и участие в ежедневных митингах",1.0
"Основы программирования на C++","Использование библиотек и фреймворков C++ для решения задач (STL, Boost)",0.6
"Оптимизировать автотесты","Улучшение производительности и стабильности тестовых сценариев",1.0
"Определять выбор технических средств для макета","Базовое понимание принципов выбора технических средств для макетирования",0.2
"Осуществлять автоматическое тестирование","Оптимизация существующих автотестов для повышения их эффективности и скорости выполнения",0.5
"Использовать информационные технологии","Участие в обучении или тестировании новых IT-решений под руководством опытных специалистов",0.3
"Настраивать автоматизацию процессов","Создание триггеров, шаблонов и автоматических рассылок",0.9
"Тестировать нефункциональные требования","Проверка соответствия системы заданным критериям через нагрузочное и стресс-тестирование",0.1
"Использовать IT в деятельности","Применять Blender для анимации",0.3
"Оценивать соответствие требованиям качества","Знакомство с концепцией требований качества и их значением",0.1
"Обеспечивать кибербезопасность","Знакомство с основами информационной безопасности и типичными угрозами",0.1
"Защищать данные в облаке","Настройка шифрования и контроля доступа в облачных хранилищах",1.0
"Настраивать облачные сервисы","Интеграция облачных сервисов с существующими IT-системами предприятия",0.5
"Применение JavaScript","Отсутствие опыта или знаний в области применения JavaScript",0.0
"Курс предназначен для начинающих программистов.","Программа ориентирована на продвинутых специалистов.",0.2
"Осуществлять программирование и тестирование","Знакомство с основами написания кода и тестирования программ",0.1
"Инженерная графика","Работа с 3D-моделированием в Blender",0.6
"Идентифицировать риски","Выявление потенциальных угроз и слабых мест в проекте или процессе",0.9
"Обязательно знание SQL","Выполнение операций импорта/экспорта данных и создание отчетов через SQL",0.5
"Осуществлять программирование и тестирование","Отсутствие опыта или знаний в области программирования и тестирования",0.0
"Визуализировать идеи","Перевод абстрактных концепций в понятные схемы, эскизы или прототипы",0.4
"Управлять инфраструктурой как код (IaC)","Работа с Terraform, Ansible или CloudFormation для автоматизации",0.7
"Настраивать документооборот","Автоматизация процессов учета, отчетности и документооборота в 1С",0.6
"Работать с системами контроля версий","Эффективное использование Git для управления кодовой базой",0.2
"Обеспечивать безопасность","Защита данных и предотвращение несанкционированного доступа",0.2
"Проектировать архитектуру ПО","Разработка масштабируемых и поддерживаемых систем",0.7
"Настраивать учетные операции","Автоматизация финансового, управленческого и складского учета",0.7
"Управлять конфликтами","Снижение напряженности и поиск конструктивных решений",0.6
"Осуществлять коммуникацию на государственном языке","Вести переговоры с клиентами",0.7
"Масштабировать приложения","Настройка автоматического масштабирования под нагрузку",0.5
"Использовать NLP-библиотеки","Работа с Hugging Face, NLTK, SpaCy или Transformers для анализа языка",0.7
"Обеспечивать безопасность","Защита приложений от атак (XSS, CSRF, SQL-инъекции)",0.3
"Обеспечивать кибербезопасность","Проведение аудита безопасности и тестирование на проникновение (Penetration Testing)",0.8
"Математический анализ","Анализ и оптимизация систем с использованием методов математического анализа",0.7
"Анализировать рынок IT-услуг","Исследование спроса на IT-услуги и прогнозирование роста сегментов рынка",0.9
"Ставить задачи команде разработчиков","Знакомство с процессом делегирования задач команде",0.1
"Писать код для мобильных платформ","Создание приложений для iOS и Android с использованием Swift, Kotlin или Java",0.9
"Создавать Use Case-диаграммы","Визуализация взаимодействия акторов и системы через UML",0.9
"Обеспечивать отказоустойчивость систем","Настройка RAID-массивов и репликации данных",0.1
"Оптимизировать производительность","Улучшение скорости работы скриптов и снижение нагрузки на браузер",0.5
"Основы программирования на C++","Знакомство с основами программирования и базовыми принципами C++",0.1
"Текстурировать модели","Нанесение текстур и материалов для реалистичности объектов",0.6
"Заниматься самообразованием","Чтение профессиональной литературы, статей и исследований для углубления знаний",0.8
"Разрабатывать технические задания","Создание детальных ТЗ для разработчиков и тестировщиков",0.9
"Определять выбор технических средств для макета","Подготовка рекомендаций по выбору технических средств для команды дизайнеров",0.6
"Формулировать выводы","Подготовка отчетов и рекомендаций на основе анализа данных",0.2
"Оптимизировать бизнес-процессы","Анализ и улучшение процессов через возможности ERP",1.0
"Осуществлять программирование и тестирование","Выполнение ручного тестирования программных продуктов на соответствие требованиям",0.3
"Оптимизировать работу АСУ","Настройка параметров для повышения эффективности и производительности",0.9
"Обеспечивать безопасность ПО","Защита данных и предотвращение уязвимостей в коде",0.5
"Анализировать и синтезировать информацию","Проводить анализ требований",0.8
"Готовить техническую документация","Отсутствие опыта или знаний в области подготовки технической документации",0.0
"Поддерживать отказоустойчивость","Настройка резервного копирования и аварийного восстановления",0.1
"Строительная механика","Опыт работы с САПР для строительства",0.6
"Адаптироваться к изменениям","Гибкое реагирование на новые требования или условия проекта",0.5
"Обеспечивать безопасность данных","Шифрование данных и защита от уязвимостей",0.4
"Использовать CASE-инструменты","Работа с базовыми инструментами, такими как Lucidchart или Draw.io",0.3
"Разработчик мобильных приложений","Разработка нативных приложений для iOS (Swift) и Android (Kotlin/Java) с учетом специфики платформ",0.9
"Обеспечивать безопасность","Формулирование требований к защите данных, аутентификации и авторизации",0.7
