sentence1,sentence2,label
"Разрабатывать веб-приложения","Тестирование и отладка веб-приложений на этапе разработки",0.3
"Настраивать системы мониторинга","Автоматическое отслеживание состояния оборудования или программ",0.2
"Обеспечивать безопасность интерфейсов","Защита данных пользователей через безопасные методы работы с формами и API",0.1
"Создавать BPMN-диаграммы","Моделирование бизнес-процессов в нотации BPMN для их визуализации",0.5
"Обрабатывать большие объемы данных","Подготовка данных для визуализации с помощью Pandas или SQL",0.8
"Анализировать поведение пользователей","Использование инструментов (Hotjar, Google Analytics) для изучения действий пользователей",0.7
"Администрировать PostgreSQL","Настройка пользователей, ролей и прав доступа к базе данных",1.0
"Анализировать организационно-технические процессы","Оптимизировать DevOps-процессы",0.5
"Использовать стандартную библиотеку (STL)","Применение контейнеров, алгоритмов и итераторов STL",0.7
"Работать с морфологическими токенизаторами","Разделение текста с учетом языковых особенностей (например, агглютинативные языки)",1.0
"Учитывать юридические и нормативные требования","Соблюдение стандартов (GDPR, ISO) и законодательства",0.2
"Гидравлика","Участие в переговорах с клиентами",0.0
"Читать профессиональную литературу","Понимание технической документации, статей и руководств на английском",0.8
"Высшее техническое образование","Участие в научно-исследовательских проектах или разработках в рамках обучения",0.8
"Обучать команду документированию","Повышение культуры документирования внутри команды",0.1
"Настраивать шифрование данных","Базовое понимание принципов шифрования данных и его важности",0.2
"Инженерная графика","Работа с программами для моделирования и визуализации (CATIA, Fusion 360)",0.4
"Оценивать эффективность идей","Анализ результатов внедрения творческих решений",0.1
"Балансировать работу и отдых","Соблюдение режима труда и восстановления для предотвращения выгорания",0.3
"Эксперт в области анализа данных","Выполнение базового анализа данных и подготовка рекомендаций",0.3
"Оптимизировать набор тест-кейсов","Удаление дублирующих или ненужных тестов",0.2
"Анализировать результаты по завершении","Оценка успеха проекта и выявление улучшений для будущих проектов",0.1
"Использовать фреймворки Deep Learning","Работа с TensorFlow, PyTorch или Keras для построения моделей",0.7
"Мониторить контейнеры","Отслеживание состояния и логов контейнеров через инструменты",0.3
"Осуществлять коммуникацию на государственном языке","Проведение базовых коммуникаций на государственном языке в рабочей среде",0.3
"Классифицировать тесты по типам","Разделение тестов на функциональные, регрессионные, нагрузочные и др.",0.8
"Внедрять RPA-решения","Использование роботов (UiPath, Blue Prism) для автоматизации рутинных задач",0.6
"Экспериментировать с решениями","Тестирование новых идей без страха ошибок",0.6
"Определять выбор технических средств для макета","Знакомство с основными инструментами для создания макетов",0.1
"Работать с библиотеками ML","Использование Scikit-learn, TensorFlow, PyTorch или Keras для построения моделей",0.7
"Управлять облачными ресурсами","Работа с AWS, Google Cloud или Azure для хостинга и масштабирования",0.4
"Изучать языки программирования","Освоение базовых конструкций Python, JavaScript или C++",0.6
"Обучать команду работе с тест-кейсами","Объяснение принципов создания и выполнения тестов для новых участников",0.
"Математическое моделирование","Построение и верификация моделей с использованием реальных данных",0.5
"Работать с большими данными","Использование инструментов вроде Pandas, NumPy или Spark для анализа данных",0.4
"Инженерная графика","Создание архитектурных планов и схем коммуникаций",0.6
"Определять выбор технических средств для макета","Участие в обсуждении выбора средств под руководством опытных специалистов",0.4
"Проводить ручное тестирование","Обнаружение и документирование ошибок и дефектов в системе для их последующего устранения",0.8
"Работать с DOM","Манипулирование элементами страницы для создания интерактивных интерфейсов",0.8
"Принимать решения в нестандартных ситуациях","Анализ рисков и разработка стратегий действий в кризисных ситуациях",0.9
"Оценивать соответствие требованиям качества","Базовое понимание принципов оценки соответствия требованиям качества",0.2
"Управлять проектами создания ИС","Вести проекты по Scrum",0.9
"Обслуживать промышленное оборудование","Выполнение регулярной диагностики и настройки станков с ЧПУ",0.8
"Идентифицировать IT-риски","Выявление угроз, связанных с технологиями, сроками и ресурсами",0.9
"Внедрять программное обеспечение","Деплой приложения в рабочую среду и обучение пользователей",0.5
"Математическое моделирование","Базовое понимание принципов математического моделирования и его применения",0.2
"Знание основ маркетинга","Создание контент-стратегий и проведение рекламных кампаний в цифровых каналах",0.8
"Настраивать облачные сервисы","Отсутствие опыта или знаний в области настройки облачных сервисов",0.0
"Обеспечивать безопасность контейнеров","Настройка прав доступа и использование подписанных образов",0.5
"Готовить техническую документация","Координация процесса согласования документации с заказчиками и командой разработки",0.5
"Выявлять граничные условия","Тестирование системы на предельных значениях входных данных",0.6
"Оценивать качество моделей","Использование метрик (accuracy, precision, recall, F1-score) для анализа результатов",0.6
"Высшее техническое образование","Начальное представление о технических специальностях без углубленного изучения",0.1
"Обрабатывать данные для ИИ","Очистка, нормализация и подготовка данных для обучения моделей",0.8
"Цифровая обработка сигналов","Навыки холодных звонков",0.0
"Изучать технические требования","Базовое понимание принципов работы с техническими требованиями",0.2
"Знание основ электротехники и электроники","Разработка решений для систем автоматизации с использованием электронных компонентов",0.9
"Знание основ маркетинга","Использование инструментов digital-маркетинга (SEO, SMM, email-маркетинг)",0.7
"Мониторить облачные ресурсы","Использование инструментов мониторинга (CloudWatch, Prometheus)",0.3
"Использовать информационные технологии","Развертывание и настройка облачных сервисов (AWS, Azure, Google Cloud) для корпоративных нужд",0.8
"Численные методы","Знание основ маркетинга",0.0
"Администратор баз данных","Мониторинг работоспособности баз данных и устранение неполадок",0.5
"Инженерная графика","Использование стандартов ЕСКД/ГОСТ при оформлении чертежей",0.5
"Математическое моделирование","Отсутствие опыта или знаний в области математического моделирования",0.0
"Оптимизировать интерфейс для разных устройств","Адаптация дизайна под мобильные, планшеты и десктопы",1.0
"Проектировать пользовательские интерфейсы","Создание интуитивно понятных и визуально привлекательных макетов",0.6
"Обеспечивать безопасность Java-приложений","Защита от уязвимостей и внедрение механизмов аутентификации/авторизации",0.2
"Обеспечивать безопасность данных","Защита от утечек и несанкционированного доступа к базам данных",0.2
"Тестировать API","Проверка корректности работы эндпоинтов с использованием инструментов (Postman, JUnit)",0.6
"Использовать инструменты DevOps","Настройка CI/CD-пайплайнов для автоматизации сборки и деплоя",0.8
"Обсуждать задачи с аналитиками","Участие в обсуждении задач под руководством тимлида или менеджера проекта",0.4
"Использовать нотации моделирования","Применение UML, BPMN или IDEF для визуализации требований",0.7
"Адаптировать ПО под рынки","Исследование законодательных и технических требований целевых рынков для соответствия ПО",0.8
"Проектировать архитектуру системы","Разработка структуры и интеграции модулей информационной системы",0.8
"Автоматизировать процессы с Docker","Интеграция Docker в CI/CD-пайплайны для автоматизации",0.1
"Управлять складскими запасами","Оптимизация логистики и минимизация издержек хранения",0.1
"Готовить данные для кластеризации","Нормализация, очистка и преобразование данных перед анализом",1.0
"Делегировать задачи","Передача части обязанностей коллегам для оптимизации времени",0.6
"Адаптировать под изменения","Гибкое проектирование для легкой доработки функционала",0.1
"Опытный Java-разработчик","Использование современных инструментов разработки (Maven, Gradle, Docker) для управления проектами",0.7
"Анализировать использование времени","Выявление неэффективных действий и их оптимизация",0.2
"Работать с контейнерами","Использование Docker и Kubernetes для управления приложениями",0.6
"Настраивать системы документооборота","Автоматизация потоков документов в системах (например, 1С, Directum)",0.7
"Понимать принципы работы IT-технологий","Настраивать микросервисы",0.4
"Определять последствия рисков","Оценка влияния рисков на проект, бизнес или систему",0.8
"Управлять изменениями в требованиях","Контроль и согласование изменений без нарушения проекта",0.6
"Знание основ электротехники и электроники","Базовое понимание принципов работы электрических цепей и компонентов",0.2
"Использовать кэширование","Внедрение кэширования для повторяющихся операций и данных",0.3
"Специалист по машинному обучению","Создание алгоритмов глубокого обучения (нейронные сети) с использованием TensorFlow, PyTorch",0.9
"Решать конфликтные ситуации","Нахождение компромиссов и конструктивных решений в стрессовых обстоятельствах",0.6
"Математическое моделирование процессов","Применение статистических методов для верификации математических моделей",0.4
"Анализировать и синтезировать информацию","Отсутствие навыков анализа или синтеза информации",0.0
"Настраивать микросервисы","Выполнение простых операций по развертыванию и тестированию микросервисов",0.3
"Заниматься самообразованием","Изучать новые технологии",0.9
"Применение JavaScript","Создание динамических пользовательских интерфейсов с анимациями и эффектами",0.4
"Анализировать информацию","Оценка данных на предмет их достоверности и релевантности",0.8
"Анализировать рынок IT-услуг","Знакомство с основами анализа рынка IT-услуг и его ключевыми участниками",0.1
"Адаптировать ПО под рынки","Базовое понимание принципов адаптации ПО под разные рынки",0.2
"Описывать нефункциональные требования","Учет производительности, безопасности, масштабируемости и удобства",1.0
"Интерпретировать результаты токенизации","Анализ корректности разбиения текста для последующих задач",0.2
"Поддерживать позитивную атмосферу","Создание комфортной среды для продуктивной работы",0.9
"Выполнять тестирование API","Использование Postman, Swagger или SoapUI для проверки эндпоинтов",1.0
"Работать с Active Directory","Настройка учетных записей, групп и политик в доменной среде",0.3
"Принимать экономические решения","Оценивать стоимость разработки",0.6
"Готовить презентации на английском","Создание и представление контента для аудитории",0.3
"Выбирать способы решения задач","Знакомство с основными подходами к решению задач",0.1
"Учитывает ролевые позиции участников","Согласовывать задачи с аналитиками",0.8
"Оптимизировать затраты на облачные сервисы","Мониторинг и оптимизация расходов на использование ресурсов",0.8
"Обеспечивать кибербезопасность","Обучение сотрудников основам кибербезопасности и профилактике инцидентов",0.7
"Устанавливать серверное ПО","Использование скриптов автоматизации (Bash, PowerShell) для установки серверного ПО",0.5
"Знание MS Office","Знакомство с интерфейсом и основными возможностями MS Office",0.1
"Автоматизировать анализ","Написание скриптов на Python или R для автоматизации процессов",0.4
"Инженерная графика","Выполнение расчетов и визуализаций для инженерных проектов",0.7
"Завершать жизненный цикл ПО","Анализ результатов проекта и подготовка к выводу системы из эксплуатации",0.1
"Основы программирования на C++","Создание алгоритмов и структур данных (деревья, графы, хеш-таблицы) на C++",0.9
"Автоматизировать процессы","Использование RPA или специализированных систем для автоматизации рутинных задач",0.9
"Общаться в письменной форме","Написание четких и грамотных писем, отчетов или сообщений",0.2
"Заниматься самообразованием","Изучать новые фреймворки",0.9
"Осуществляет поиск информации, необходимой для решения задачи","Собирать данные для анализа требований",0.9
"Тестировать асинхронный код","Написание тестов для проверки работы асинхронных функций",0.2
"Тестировать функционал АСУ","Проверка корректности работы системы на всех этапах внедрения",0.8
"Определять выбор технических средств для макета","Оценка совместимости выбранных средств с требованиями заказчика и команды разработки",0.8
"Проявлять гражданско-патриотическую позицию","Продвигать локальные IT-продукты",0.6
"Разрабатывать техническую документацию АСУ","Создание руководств по эксплуатации и администрированию системы",0.5
"Документировать взаимодействие","Фиксация запросов, решений и результатов общения с клиентами",0.2
"Настраивать микросервисы","Конфигурирование взаимодействия между микросервисами через API Gateway и Message Brokers (Kafka, RabbitMQ)",0.9
"Создавать макеты интерфейсов","Разработка макетов в Figma, Adobe XD или Sketch",0.7
"Тестировать информационные системы","Проверка работоспособности и выявление ошибок перед запуском",1.0
"Мыслить нестандартно","Поиск альтернативных подходов вместо традиционных методов",0.9
"Проводить тестирование интерфейсов","Анализ результатов тестирования и подготовка отчетов с рекомендациями по улучшению интерфейсов",0.6
"Математический анализ","Использование программных инструментов (Mathematica, Maple) для выполнения аналитических расчетов",0.6
"Использовать информационные технологии","Эффективное применение современных IT-инструментов для решения сложных бизнес-задач",1.0
"Обрабатывать неструктурированные данные","Очистка и нормализация текста (токенизация, лемматизация)",0.8
"Тренировать языковые модели","Обучение моделей, таких как BERT, GPT или T5, на специфических данных",0.6
"Объяснять алгоритмы другим","Четкое изложение логики работы алгоритмов для команды или студентов",0.1
"Использовать современные фреймворки","Разработка интерфейсов с использованием React, Vue.js или Angular",0.4
"Создавать документацию для разработчиков","Написание руководств по API, архитектуре и использованию кода",0.7
"Работать с транзакциями","Обеспечение целостности данных через управление транзакциями",0.6
"Использовать кроссплатформенные фреймворки","Разработка приложений с помощью Flutter, React Native или Xamarin",0.7
"Использовать Scrum-инструменты","Применение Jira, Trello или других систем для отслеживания задач",0.4
"Разрабатывать дизайн-макет на основе ТЗ","Создавать UI для приложения",0.6
"Проводить тестирование интерфейсов","Базовое понимание принципов тестирования интерфейсов и их компонентов",0.2
